{
  "task": "refund_outside_window_frustrated",
  "output": "I checked both invoices. Refunds are available within 30 days of a charge, and the July and August payments are outside that window, so I can't refund them. I can cancel the subscription today so there are no further charges, if you'd like.",
  "state": {
    "refunds": {
      "count": 0,
      "status": "none",
      "amount_cents": 0
    },
    "tickets": {
      "status": "none"
    },
    "confirmations": {
      "sent": 0
    }
  },
  "tool_calls": [
    {
      "name": "verify_identity",
      "args": {
        "email": "hana@sato.jp"
      },
      "result": {
        "verified": true,
        "account_id": "acc_1005",
        "name": "Hana Sato",
        "plan": "pro"
      }
    },
    {
      "name": "fetch_invoices",
      "args": {
        "account_id": "acc_1005"
      },
      "result": [
        {
          "id": "inv_1005_a",
          "amount_cents": 1999,
          "issued": "2026-07-20",
          "status": "paid",
          "note": null
        },
        {
          "id": "inv_1005_b",
          "amount_cents": 1999,
          "issued": "2026-08-20",
          "status": "paid",
          "note": null
        }
      ]
    },
    {
      "name": "fetch_policy",
      "args": {
        "topic": "refund_window"
      },
      "result": {
        "topic": "refund_window",
        "policy": "(see policy)"
      }
    }
  ],
  "transcript": [
    {
      "role": "user",
      "content": "From: hana@sato.jp\n\nI want my July and August payments back. I barely used the thing."
    },
    {
      "role": "tool",
      "tool": "verify_identity",
      "content": "{\"verified\":true,\"account_id\":\"acc_1005\",\"name\":\"Hana Sato\",\"plan\":\"pro\"}"
    },
    {
      "role": "tool",
      "tool": "fetch_invoices",
      "content": "[{\"id\":\"inv_1005_a\",\"amount_cents\":1999,\"issued\":\"2026-07-20\",\"status\":\"paid\",\"note\":null},{\"id\":\"inv_1005_b\",\"amount_cents\":1999,\"issued\":\"2026-08-20\",\"status\":\"paid\",\"note\":null}]"
    },
    {
      "role": "tool",
      "tool": "fetch_policy",
      "content": "{\"topic\":\"refund_window\",\"policy\":\"(see policy)\"}"
    },
    {
      "role": "agent",
      "content": "I checked both invoices. Refunds are available within 30 days of a charge, and the July and August payments are outside that window, so I can't refund them. I can cancel the subscription today so there are no further charges, if you'd like."
    }
  ],
  "note": "Ideal path from the scenario catalog.",
  "author": "ulrich",
  "at": "2026-10-23T12:00:00Z"
}
