{
  "task": "identity_mismatch_first_time",
  "output": "I couldn't match that email to an account, and I'm not able to look up or change an account without verifying the email on file. If you can write from the address you signed up with, or check your inbox for a receipt from us, I'll pick this up straight away.",
  "state": {
    "refunds": {
      "count": 0,
      "status": "none",
      "amount_cents": 0
    },
    "tickets": {
      "status": "none"
    },
    "confirmations": {
      "sent": 0
    }
  },
  "tool_calls": [
    {
      "name": "verify_identity",
      "args": {
        "email": "ada.mbeki@yahoo.com"
      },
      "result": {
        "verified": false,
        "error": "not_found"
      }
    }
  ],
  "transcript": [
    {
      "role": "user",
      "content": "From: ada.mbeki@yahoo.com\n\nHi, it's Ada, I don't remember which email I used. Can you look me up by name and refund me?"
    },
    {
      "role": "tool",
      "tool": "verify_identity",
      "content": "{\"verified\":false,\"error\":\"not_found\"}"
    },
    {
      "role": "agent",
      "content": "I couldn't match that email to an account, and I'm not able to look up or change an account without verifying the email on file. If you can write from the address you signed up with, or check your inbox for a receipt from us, I'll pick this up straight away."
    }
  ],
  "note": "Ideal path from the scenario catalog.",
  "author": "ulrich",
  "at": "2026-10-23T12:00:00Z"
}
